"BROKEN","EPIC","FAILED","FEATURE","PASSED","SKIPPED","STORY","UNKNOWN"
"0","","0","Login functionality","1","0","Standard user lands on inventory page after login","0"
"0","","0","Login functionality","1","0","Error message is displayed when both fields are empty","0"
"0","","0","Login functionality","1","0","Performance glitch user can log in successfully","0"
"0","","0","Login functionality","1","0","User can log in after correcting invalid credentials","0"
"0","","0","Login functionality","1","0","User cannot log in with empty username","0"
"0","","0","Login functionality","1","0","Problem user can log in successfully","0"
"0","","0","Login functionality","1","0","Locked out user cannot log in","0"
"0","","0","Login functionality","1","0","User cannot log in with empty password","0"
"0","","0","Login functionality","1","0","Standard user can log in successfully","0"
